{
  "available": 14,
  "count": 14,
  "fetchedAt": "2026-10-14",
  "source": {"id":"rules-format","kind":"rules","license":"코드쇼퍼가 쓴 설명 (사실은 각 공식 문서 기준)","name":"코드쇼퍼 정리: 지침 파일 형식","note":"written: codeshopper","url":"https://agents.md/"},
  "items": [
    {"category":"ai","fetchedAt":"2026-10-14","id":"rules-format:agents-md","kind":"rules","name":"AGENTS.md","preview":{"file":"AGENTS.md","tools":["Codex","Cursor","GitHub Copilot","Kiro","OpenCode","Windsurf"],"type":"prompt"},"source":{"name":"코드쇼퍼 정리 (공식 문서 기준)","url":"https://agents.md/"},"summary":"여러 코딩 에이전트가 함께 읽는 공개 형식의 지침 파일이다. 저장소 맨 위에 두고 빌드·시험 명령, 코드 규칙, 주의할 점을 적는다.","summaryKo":"여러 코딩 에이전트가 함께 읽는 공개 형식의 지침 파일이다. 저장소 맨 위에 두고 빌드·시험 명령, 코드 규칙, 주의할 점을 적는다.","tags":["codex","cross-agent","cursor","format","github-copilot","kiro","open-format","opencode","windsurf"],"url":"https://agents.md/","use":{"docs":"https://agents.md/"},"written":"codeshopper"},
    {"category":"ai","fetchedAt":"2026-10-14","id":"rules-format:aider-conventions","kind":"rules","name":"Aider CONVENTIONS.md","preview":{"file":"CONVENTIONS.md","tools":["Aider"],"type":"prompt"},"source":{"name":"코드쇼퍼 정리 (공식 문서 기준)","url":"https://aider.chat/docs/usage/conventions.html"},"summary":"Aider에게 코드 규칙을 알려 주는 파일이다. 읽기 전용으로 불러와 대화마다 참고하게 한다.","summaryKo":"Aider에게 코드 규칙을 알려 주는 파일이다. 읽기 전용으로 불러와 대화마다 참고하게 한다.","tags":["aider","format"],"url":"https://aider.chat/docs/usage/conventions.html","use":{"docs":"https://aider.chat/docs/usage/conventions.html"},"written":"codeshopper"},
    {"category":"ai","fetchedAt":"2026-10-14","id":"rules-format:augment-rules","kind":"rules","name":"Augment Rules","preview":{"file":".augment/rules/","tools":["Augment Code"],"type":"prompt"},"source":{"name":"코드쇼퍼 정리 (공식 문서 기준)","url":"https://docs.augmentcode.com/setup-augment/guidelines"},"summary":"Augment Code가 읽는 규칙이다. .augment/rules 폴더에 두며, 예전 .augment-guidelines 파일도 문서에 나온다.","summaryKo":"Augment Code가 읽는 규칙이다. .augment/rules 폴더에 두며, 예전 .augment-guidelines 파일도 문서에 나온다.","tags":["augment","augment-code","format"],"url":"https://docs.augmentcode.com/setup-augment/guidelines","use":{"docs":"https://docs.augmentcode.com/setup-augment/guidelines"},"written":"codeshopper"},
    {"category":"ai","fetchedAt":"2026-10-14","id":"rules-format:claude-md","kind":"rules","name":"CLAUDE.md","preview":{"file":"CLAUDE.md","tools":["Claude Code"],"type":"prompt"},"source":{"name":"코드쇼퍼 정리 (공식 문서 기준)","url":"https://code.claude.com/docs/en/memory"},"summary":"Claude Code가 세션을 시작할 때 읽는 기억 파일이다. 프로젝트 맨 위나 하위 폴더에 두고 명령, 구조, 지킬 규칙을 적는다.","summaryKo":"Claude Code가 세션을 시작할 때 읽는 기억 파일이다. 프로젝트 맨 위나 하위 폴더에 두고 명령, 구조, 지킬 규칙을 적는다.","tags":["claude","claude-code","format"],"url":"https://code.claude.com/docs/en/memory","use":{"docs":"https://code.claude.com/docs/en/memory"},"written":"codeshopper"},
    {"category":"ai","fetchedAt":"2026-10-14","id":"rules-format:clinerules","kind":"rules","name":"Cline Rules","preview":{"file":".clinerules","tools":["Cline"],"type":"prompt"},"source":{"name":"코드쇼퍼 정리 (공식 문서 기준)","url":"https://docs.cline.bot/customization/cline-rules"},"summary":"Cline이 읽는 프로젝트 규칙이다. .clinerules 파일이나 폴더에 마크다운으로 적는다.","summaryKo":"Cline이 읽는 프로젝트 규칙이다. .clinerules 파일이나 폴더에 마크다운으로 적는다.","tags":["cline","format"],"url":"https://docs.cline.bot/customization/cline-rules","use":{"docs":"https://docs.cline.bot/customization/cline-rules"},"written":"codeshopper"},
    {"category":"ai","fetchedAt":"2026-10-14","id":"rules-format:codex-agents-md","kind":"rules","name":"Codex AGENTS.md","preview":{"file":"AGENTS.md","tools":["Codex"],"type":"prompt"},"source":{"name":"코드쇼퍼 정리 (공식 문서 기준)","url":"https://learn.chatgpt.com/docs/agent-configuration/agents-md"},"summary":"Codex가 작업 전에 읽는 AGENTS.md 사용법이다. 전역·프로젝트·하위 폴더 파일을 겹쳐 읽는다.","summaryKo":"Codex가 작업 전에 읽는 AGENTS.md 사용법이다. 전역·프로젝트·하위 폴더 파일을 겹쳐 읽는다.","tags":["agents-md","codex","format","openai"],"url":"https://learn.chatgpt.com/docs/agent-configuration/agents-md","use":{"docs":"https://learn.chatgpt.com/docs/agent-configuration/agents-md"},"written":"codeshopper"},
    {"category":"ai","fetchedAt":"2026-10-14","id":"rules-format:continue-rules","kind":"rules","name":"Continue Rules","preview":{"file":".continue/rules/","tools":["Continue"],"type":"prompt"},"source":{"name":"코드쇼퍼 정리 (공식 문서 기준)","url":"https://docs.continue.dev/customize/deep-dives/rules"},"summary":"Continue가 읽는 규칙이다. .continue/rules 폴더에 마크다운 파일로 둔다.","summaryKo":"Continue가 읽는 규칙이다. .continue/rules 폴더에 마크다운 파일로 둔다.","tags":["continue","format"],"url":"https://docs.continue.dev/customize/deep-dives/rules","use":{"docs":"https://docs.continue.dev/customize/deep-dives/rules"},"written":"codeshopper"},
    {"category":"ai","fetchedAt":"2026-10-14","id":"rules-format:copilot-instructions","kind":"rules","name":"Copilot repository instructions","preview":{"file":".github/copilot-instructions.md","tools":["GitHub Copilot"],"type":"prompt"},"source":{"name":"코드쇼퍼 정리 (공식 문서 기준)","url":"https://docs.github.com/en/copilot/how-tos/copilot-on-github/customize-copilot/add-custom-instructions/add-repository-instructions"},"summary":"GitHub Copilot이 저장소 전체에 적용하는 지침 파일이다. 경로별 지침은 .github/instructions/*.instructions.md에 applyTo와 함께 둔다.","summaryKo":"GitHub Copilot이 저장소 전체에 적용하는 지침 파일이다. 경로별 지침은 .github/instructions/*.instructions.md에 applyTo와 함께 둔다.","tags":["copilot","format","github-copilot"],"url":"https://docs.github.com/en/copilot/how-tos/copilot-on-github/customize-copilot/add-custom-instructions/add-repository-instructions","use":{"docs":"https://docs.github.com/en/copilot/how-tos/copilot-on-github/customize-copilot/add-custom-instructions/add-repository-instructions"},"written":"codeshopper"},
    {"category":"ai","fetchedAt":"2026-10-14","id":"rules-format:cursor-rules","kind":"rules","name":"Cursor Project Rules","preview":{"file":".cursor/rules/*.mdc","tools":["Cursor"],"type":"prompt"},"source":{"name":"코드쇼퍼 정리 (공식 문서 기준)","url":"https://cursor.com/docs/context/rules"},"summary":"Cursor가 읽는 프로젝트 규칙이다. .cursor/rules 폴더에 머리말(description·globs·alwaysApply)이 있는 .mdc 파일로 둔다.","summaryKo":"Cursor가 읽는 프로젝트 규칙이다. .cursor/rules 폴더에 머리말(description·globs·alwaysApply)이 있는 .mdc 파일로 둔다.","tags":["cursor","format","mdc"],"url":"https://cursor.com/docs/context/rules","use":{"docs":"https://cursor.com/docs/context/rules"},"written":"codeshopper"},
    {"category":"ai","fetchedAt":"2026-10-14","id":"rules-format:gemini-md","kind":"rules","name":"GEMINI.md","preview":{"file":"GEMINI.md","tools":["Gemini CLI"],"type":"prompt"},"source":{"name":"코드쇼퍼 정리 (공식 문서 기준)","url":"https://geminicli.com/docs/cli/gemini-md/"},"summary":"Gemini CLI가 맥락으로 읽는 지침 파일이다. 프로젝트와 상위 폴더의 GEMINI.md를 모아 모델에 넘긴다.","summaryKo":"Gemini CLI가 맥락으로 읽는 지침 파일이다. 프로젝트와 상위 폴더의 GEMINI.md를 모아 모델에 넘긴다.","tags":["format","gemini","gemini-cli"],"url":"https://geminicli.com/docs/cli/gemini-md/","use":{"docs":"https://geminicli.com/docs/cli/gemini-md/"},"written":"codeshopper"},
    {"category":"ai","fetchedAt":"2026-10-14","id":"rules-format:kiro-steering","kind":"rules","name":"Kiro Steering","preview":{"file":".kiro/steering/*.md","tools":["Kiro"],"type":"prompt"},"source":{"name":"코드쇼퍼 정리 (공식 문서 기준)","url":"https://kiro.dev/docs/steering/"},"summary":"Kiro가 읽는 안내(steering) 파일이다. .kiro/steering 폴더에 제품·기술·구조 같은 주제별 마크다운을 둔다.","summaryKo":"Kiro가 읽는 안내(steering) 파일이다. .kiro/steering 폴더에 제품·기술·구조 같은 주제별 마크다운을 둔다.","tags":["format","kiro"],"url":"https://kiro.dev/docs/steering/","use":{"docs":"https://kiro.dev/docs/steering/"},"written":"codeshopper"},
    {"category":"ai","fetchedAt":"2026-10-14","id":"rules-format:opencode-rules","kind":"rules","name":"OpenCode Rules","preview":{"file":"AGENTS.md","tools":["OpenCode"],"type":"prompt"},"source":{"name":"코드쇼퍼 정리 (공식 문서 기준)","url":"https://opencode.ai/docs/rules/"},"summary":"OpenCode는 프로젝트의 AGENTS.md를 규칙으로 읽는다.","summaryKo":"OpenCode는 프로젝트의 AGENTS.md를 규칙으로 읽는다.","tags":["agents-md","format","opencode"],"url":"https://opencode.ai/docs/rules/","use":{"docs":"https://opencode.ai/docs/rules/"},"written":"codeshopper"},
    {"category":"ai","fetchedAt":"2026-10-14","id":"rules-format:roo-rules","kind":"rules","name":"Roo Code Rules","preview":{"file":".roo/rules/","tools":["Roo Code"],"type":"prompt"},"source":{"name":"코드쇼퍼 정리 (공식 문서 기준)","url":"https://roocodeinc.github.io/Roo-Code/features/custom-instructions/"},"summary":"Roo Code가 읽는 사용자 지침이다. .roo/rules 폴더에 마크다운 파일로 두고, 모드별 폴더도 쓸 수 있다.","summaryKo":"Roo Code가 읽는 사용자 지침이다. .roo/rules 폴더에 마크다운 파일로 두고, 모드별 폴더도 쓸 수 있다.","tags":["format","roo-code"],"url":"https://roocodeinc.github.io/Roo-Code/features/custom-instructions/","use":{"docs":"https://roocodeinc.github.io/Roo-Code/features/custom-instructions/"},"written":"codeshopper"},
    {"category":"ai","fetchedAt":"2026-10-14","id":"rules-format:windsurf-rules","kind":"rules","name":"Windsurf / Devin Desktop Rules","preview":{"file":".devin/rules/*.md (.windsurf/rules/*.md)","tools":["Windsurf","Devin Desktop"],"type":"prompt"},"source":{"name":"코드쇼퍼 정리 (공식 문서 기준)","url":"https://docs.devin.ai/desktop/cascade/memories"},"summary":"Cascade가 읽는 작업 공간 규칙이다. 규칙 하나를 파일 하나로 .devin/rules에 두고, 예전 위치인 .windsurf/rules도 읽는다.","summaryKo":"Cascade가 읽는 작업 공간 규칙이다. 규칙 하나를 파일 하나로 .devin/rules에 두고, 예전 위치인 .windsurf/rules도 읽는다.","tags":["devin-desktop","format","windsurf"],"url":"https://docs.devin.ai/desktop/cascade/memories","use":{"docs":"https://docs.devin.ai/desktop/cascade/memories"},"written":"codeshopper"}
  ]
}
