{
  "available": 7,
  "count": 7,
  "fetchedAt": "2026-10-25",
  "source": {"id":"mcp-reference","kind":"mcp","license":"MIT (저장소 README·패키지 정보)","name":"MCP Reference Servers","note":"metrics.stars = 저장소(모노레포) 스타, metrics.downloads = 서버 꾸러미의 지난 한 주 내려받기(npm 또는 pypistats.org, preview.downloadsOf)","url":"https://github.com/modelcontextprotocol/servers"},
  "items": [
    {"category":"ai","fetchedAt":"2026-10-25","id":"mcp-reference:everything","kind":"mcp","license":"MIT","metrics":{"downloads":169257,"stars":91521,"updatedAt":"2026-10-22"},"name":"Everything","preview":{"downloadsOf":"npm:@modelcontextprotocol/server-everything","packages":[{"name":"@modelcontextprotocol/server-everything","registry":"npm"}],"transports":["stdio"],"type":"mcp"},"source":{"name":"MCP Reference Servers","url":"https://github.com/modelcontextprotocol/servers"},"summary":"Reference / test server with prompts, resources, and tools.","tags":["npm","official","reference","stdio"],"url":"https://github.com/modelcontextprotocol/servers/tree/main/src/everything","use":{"docs":"https://github.com/modelcontextprotocol/servers/tree/main/src/everything","install":"npx -y @modelcontextprotocol/server-everything","snippet":"{\"mcpServers\":{\"everything\":{\"command\":\"npx\",\"args\":[\"-y\",\"@modelcontextprotocol/server-everything\"]}}}"}},
    {"category":"ai","fetchedAt":"2026-10-25","id":"mcp-reference:fetch","kind":"mcp","license":"MIT","metrics":{"downloads":230575,"stars":91521,"updatedAt":"2026-10-22"},"name":"Fetch","preview":{"downloadsOf":"pypi:mcp-server-fetch","packages":[{"name":"mcp-server-fetch","registry":"pypi"}],"transports":["stdio"],"type":"mcp"},"source":{"name":"MCP Reference Servers","url":"https://github.com/modelcontextprotocol/servers"},"summary":"Web content fetching and conversion for efficient LLM usage.","tags":["official","pypi","reference","stdio"],"url":"https://github.com/modelcontextprotocol/servers/tree/main/src/fetch","use":{"docs":"https://github.com/modelcontextprotocol/servers/tree/main/src/fetch","install":"uvx mcp-server-fetch","snippet":"{\"mcpServers\":{\"fetch\":{\"command\":\"uvx\",\"args\":[\"mcp-server-fetch\"]}}}"}},
    {"category":"ai","fetchedAt":"2026-10-25","id":"mcp-reference:filesystem","kind":"mcp","license":"MIT","metrics":{"downloads":439752,"stars":91521,"updatedAt":"2026-10-22"},"name":"Filesystem","preview":{"downloadsOf":"npm:@modelcontextprotocol/server-filesystem","packages":[{"name":"@modelcontextprotocol/server-filesystem","registry":"npm"}],"transports":["stdio"],"type":"mcp"},"source":{"name":"MCP Reference Servers","url":"https://github.com/modelcontextprotocol/servers"},"summary":"Secure file operations with configurable access controls.","tags":["npm","official","reference","stdio"],"url":"https://github.com/modelcontextprotocol/servers/tree/main/src/filesystem","use":{"docs":"https://github.com/modelcontextprotocol/servers/tree/main/src/filesystem","install":"npx -y @modelcontextprotocol/server-filesystem","snippet":"{\"mcpServers\":{\"filesystem\":{\"command\":\"npx\",\"args\":[\"-y\",\"@modelcontextprotocol/server-filesystem\"]}}}"}},
    {"category":"ai","fetchedAt":"2026-10-25","id":"mcp-reference:git","kind":"mcp","license":"MIT","metrics":{"downloads":87939,"stars":91521,"updatedAt":"2026-10-22"},"name":"Git","preview":{"downloadsOf":"pypi:mcp-server-git","packages":[{"name":"mcp-server-git","registry":"pypi"}],"transports":["stdio"],"type":"mcp"},"source":{"name":"MCP Reference Servers","url":"https://github.com/modelcontextprotocol/servers"},"summary":"Tools to read, search, and manipulate Git repositories.","tags":["official","pypi","reference","stdio"],"url":"https://github.com/modelcontextprotocol/servers/tree/main/src/git","use":{"docs":"https://github.com/modelcontextprotocol/servers/tree/main/src/git","install":"uvx mcp-server-git","snippet":"{\"mcpServers\":{\"git\":{\"command\":\"uvx\",\"args\":[\"mcp-server-git\"]}}}"}},
    {"category":"ai","fetchedAt":"2026-10-25","id":"mcp-reference:memory","kind":"mcp","license":"MIT","metrics":{"downloads":122926,"stars":91521,"updatedAt":"2026-10-22"},"name":"Memory","preview":{"downloadsOf":"npm:@modelcontextprotocol/server-memory","packages":[{"name":"@modelcontextprotocol/server-memory","registry":"npm"}],"transports":["stdio"],"type":"mcp"},"source":{"name":"MCP Reference Servers","url":"https://github.com/modelcontextprotocol/servers"},"summary":"Knowledge graph-based persistent memory system.","tags":["npm","official","reference","stdio"],"url":"https://github.com/modelcontextprotocol/servers/tree/main/src/memory","use":{"docs":"https://github.com/modelcontextprotocol/servers/tree/main/src/memory","install":"npx -y @modelcontextprotocol/server-memory","snippet":"{\"mcpServers\":{\"memory\":{\"command\":\"npx\",\"args\":[\"-y\",\"@modelcontextprotocol/server-memory\"]}}}"}},
    {"category":"ai","fetchedAt":"2026-10-25","id":"mcp-reference:sequentialthinking","kind":"mcp","license":"MIT","metrics":{"downloads":109582,"stars":91521,"updatedAt":"2026-10-22"},"name":"Sequential Thinking","preview":{"downloadsOf":"npm:@modelcontextprotocol/server-sequential-thinking","packages":[{"name":"@modelcontextprotocol/server-sequential-thinking","registry":"npm"}],"transports":["stdio"],"type":"mcp"},"source":{"name":"MCP Reference Servers","url":"https://github.com/modelcontextprotocol/servers"},"summary":"Dynamic and reflective problem-solving through thought sequences.","tags":["npm","official","reference","stdio"],"url":"https://github.com/modelcontextprotocol/servers/tree/main/src/sequentialthinking","use":{"docs":"https://github.com/modelcontextprotocol/servers/tree/main/src/sequentialthinking","install":"npx -y @modelcontextprotocol/server-sequential-thinking","snippet":"{\"mcpServers\":{\"sequential-thinking\":{\"command\":\"npx\",\"args\":[\"-y\",\"@modelcontextprotocol/server-sequential-thinking\"]}}}"}},
    {"category":"ai","fetchedAt":"2026-10-25","id":"mcp-reference:time","kind":"mcp","license":"MIT","metrics":{"downloads":173734,"stars":91521,"updatedAt":"2026-10-22"},"name":"Time","preview":{"downloadsOf":"pypi:mcp-server-time","packages":[{"name":"mcp-server-time","registry":"pypi"}],"transports":["stdio"],"type":"mcp"},"source":{"name":"MCP Reference Servers","url":"https://github.com/modelcontextprotocol/servers"},"summary":"Time and timezone conversion capabilities.","tags":["official","pypi","reference","stdio"],"url":"https://github.com/modelcontextprotocol/servers/tree/main/src/time","use":{"docs":"https://github.com/modelcontextprotocol/servers/tree/main/src/time","install":"uvx mcp-server-time","snippet":"{\"mcpServers\":{\"time\":{\"command\":\"uvx\",\"args\":[\"mcp-server-time\"]}}}"}}
  ]
}
