{
  "available": 8,
  "count": 8,
  "fetchedAt": "2026-10-14",
  "source": {"id":"hook-copilot","kind":"hook","license":"MIT","name":"Awesome GitHub Copilot (hooks)","url":"https://github.com/github/awesome-copilot"},
  "items": [
    {"category":"ai","fetchedAt":"2026-10-14","id":"hook-copilot:attester-import-check","kind":"hook","license":"MIT","name":"Attester Import Check","preview":{"agent":"github-copilot","component":"hook","file":"hooks/attester-import-check/hooks.json","type":"skill"},"source":{"name":"Awesome GitHub Copilot (hooks)","url":"https://github.com/github/awesome-copilot"},"summary":"Verifies PyPI and npm package names against the attester.dev existence oracle before the Copilot coding agent writes them into code, blocking hallucinated dependencies","tags":["copilot","dependencies","hook","pretooluse","security","supply-chain"],"url":"https://github.com/github/awesome-copilot/tree/main/hooks/attester-import-check"},
    {"category":"ai","fetchedAt":"2026-10-14","id":"hook-copilot:dependency-license-checker","kind":"hook","license":"MIT","name":"Dependency License Checker","preview":{"agent":"github-copilot","component":"hook","file":"hooks/dependency-license-checker/hooks.json","type":"skill"},"source":{"name":"Awesome GitHub Copilot (hooks)","url":"https://github.com/github/awesome-copilot"},"summary":"Scans newly added dependencies for license compliance (GPL, AGPL, etc.) at session end","tags":["compliance","copilot","dependencies","hook","license","session-end"],"url":"https://github.com/github/awesome-copilot/tree/main/hooks/dependency-license-checker"},
    {"category":"ai","fetchedAt":"2026-10-14","id":"hook-copilot:fix-broken-links","kind":"hook","license":"MIT","name":"Fix Broken Links","preview":{"agent":"github-copilot","component":"hook","file":"hooks/fix-broken-links/hooks.json","type":"skill"},"source":{"name":"Awesome GitHub Copilot (hooks)","url":"https://github.com/github/awesome-copilot"},"summary":"Checks changed web files for broken hyperlinks and SEO anchor issues after each Copilot tool use.","tags":["copilot","hook","html","links","markdown","post-tool-use","seo"],"url":"https://github.com/github/awesome-copilot/tree/main/hooks/fix-broken-links"},
    {"category":"ai","fetchedAt":"2026-10-14","id":"hook-copilot:governance-audit","kind":"hook","license":"MIT","name":"Governance Audit","preview":{"agent":"github-copilot","component":"hook","file":"hooks/governance-audit/hooks.json","type":"skill"},"source":{"name":"Awesome GitHub Copilot (hooks)","url":"https://github.com/github/awesome-copilot"},"summary":"Scans Copilot agent prompts for threat signals and logs governance events","tags":["audit","copilot","governance","hook","safety","security"],"url":"https://github.com/github/awesome-copilot/tree/main/hooks/governance-audit"},
    {"category":"ai","fetchedAt":"2026-10-14","id":"hook-copilot:secrets-scanner","kind":"hook","license":"MIT","name":"Secrets Scanner","preview":{"agent":"github-copilot","component":"hook","file":"hooks/secrets-scanner/hooks.json","type":"skill"},"source":{"name":"Awesome GitHub Copilot (hooks)","url":"https://github.com/github/awesome-copilot"},"summary":"Scans files modified during a Copilot coding agent session for leaked secrets, credentials, and sensitive data","tags":["copilot","hook","scanning","secrets","security","session-end"],"url":"https://github.com/github/awesome-copilot/tree/main/hooks/secrets-scanner"},
    {"category":"ai","fetchedAt":"2026-10-14","id":"hook-copilot:session-auto-commit","kind":"hook","license":"MIT","name":"Session Auto-Commit","preview":{"agent":"github-copilot","component":"hook","file":"hooks/session-auto-commit/hooks.json","type":"skill"},"source":{"name":"Awesome GitHub Copilot (hooks)","url":"https://github.com/github/awesome-copilot"},"summary":"Automatically commits and pushes changes when a Copilot coding agent session ends","tags":["automation","copilot","git","hook","productivity"],"url":"https://github.com/github/awesome-copilot/tree/main/hooks/session-auto-commit"},
    {"category":"ai","fetchedAt":"2026-10-14","id":"hook-copilot:session-logger","kind":"hook","license":"MIT","name":"Session Logger","preview":{"agent":"github-copilot","component":"hook","file":"hooks/session-logger/hooks.json","type":"skill"},"source":{"name":"Awesome GitHub Copilot (hooks)","url":"https://github.com/github/awesome-copilot"},"summary":"Logs all Copilot coding agent session activity for audit and analysis","tags":["analytics","audit","copilot","hook","logging"],"url":"https://github.com/github/awesome-copilot/tree/main/hooks/session-logger"},
    {"category":"ai","fetchedAt":"2026-10-14","id":"hook-copilot:tool-guardian","kind":"hook","license":"MIT","name":"Tool Guardian","preview":{"agent":"github-copilot","component":"hook","file":"hooks/tool-guardian/hooks.json","type":"skill"},"source":{"name":"Awesome GitHub Copilot (hooks)","url":"https://github.com/github/awesome-copilot"},"summary":"Blocks dangerous tool operations (destructive file ops, force pushes, DB drops) before the Copilot coding agent executes them","tags":["copilot","guardrails","hook","pretooluse","safety","security"],"url":"https://github.com/github/awesome-copilot/tree/main/hooks/tool-guardian"}
  ]
}
