{
  "available": 8,
  "count": 8,
  "fetchedAt": "2026-10-20",
  "source": {"id":"wf-copilot","kind":"workflow","license":"MIT","name":"Awesome GitHub Copilot (agentic workflows)","url":"https://github.com/github/awesome-copilot"},
  "items": [
    {"category":"ai","fetchedAt":"2026-10-20","id":"wf-copilot:daily-issues-report","kind":"workflow","license":"MIT","name":"Daily Issues Report","preview":{"file":"workflows/daily-issues-report.md","platform":"github-agentic-workflows","type":"template"},"source":{"name":"Awesome GitHub Copilot (agentic workflows)","url":"https://github.com/github/awesome-copilot"},"summary":"Generates a daily summary of open issues and recent activity as a GitHub issue","tags":["agentic-workflow","copilot","github-actions"],"url":"https://github.com/github/awesome-copilot/blob/main/workflows/daily-issues-report.md"},
    {"category":"ai","fetchedAt":"2026-10-20","id":"wf-copilot:ospo-contributors-report","kind":"workflow","license":"MIT","name":"OSPO Contributors Report","preview":{"file":"workflows/ospo-contributors-report.md","platform":"github-agentic-workflows","type":"template"},"source":{"name":"Awesome GitHub Copilot (agentic workflows)","url":"https://github.com/github/awesome-copilot"},"summary":"Monthly contributor activity metrics across an organization's repositories.","tags":["agentic-workflow","copilot","github-actions"],"url":"https://github.com/github/awesome-copilot/blob/main/workflows/ospo-contributors-report.md"},
    {"category":"ai","fetchedAt":"2026-10-20","id":"wf-copilot:ospo-org-health","kind":"workflow","license":"MIT","name":"OSPO Organization Health Report","preview":{"file":"workflows/ospo-org-health.md","platform":"github-agentic-workflows","type":"template"},"source":{"name":"Awesome GitHub Copilot (agentic workflows)","url":"https://github.com/github/awesome-copilot"},"summary":"Comprehensive weekly health report for a GitHub organization. Surfaces stale issues/PRs, merge time analysis, contributor leaderboards, and actionable items needing human attention.","tags":["agentic-workflow","copilot","github-actions"],"url":"https://github.com/github/awesome-copilot/blob/main/workflows/ospo-org-health.md"},
    {"category":"ai","fetchedAt":"2026-10-20","id":"wf-copilot:ospo-release-compliance-checker","kind":"workflow","license":"MIT","name":"OSS Release Compliance Checker","preview":{"file":"workflows/ospo-release-compliance-checker.md","platform":"github-agentic-workflows","type":"template"},"source":{"name":"Awesome GitHub Copilot (agentic workflows)","url":"https://github.com/github/awesome-copilot"},"summary":"Analyzes a target repository against open source release requirements and posts a detailed compliance report as an issue comment.","tags":["agentic-workflow","copilot","github-actions"],"url":"https://github.com/github/awesome-copilot/blob/main/workflows/ospo-release-compliance-checker.md"},
    {"category":"ai","fetchedAt":"2026-10-20","id":"wf-copilot:ospo-stale-repos","kind":"workflow","license":"MIT","name":"OSPO Stale Repository Report","preview":{"file":"workflows/ospo-stale-repos.md","platform":"github-agentic-workflows","type":"template"},"source":{"name":"Awesome GitHub Copilot (agentic workflows)","url":"https://github.com/github/awesome-copilot"},"summary":"Identifies inactive repositories in your organization and generates an archival recommendation report.","tags":["agentic-workflow","copilot","github-actions"],"url":"https://github.com/github/awesome-copilot/blob/main/workflows/ospo-stale-repos.md"},
    {"category":"ai","fetchedAt":"2026-10-20","id":"wf-copilot:relevance-check","kind":"workflow","license":"MIT","name":"Relevance Check","preview":{"file":"workflows/relevance-check.md","platform":"github-agentic-workflows","type":"template"},"source":{"name":"Awesome GitHub Copilot (agentic workflows)","url":"https://github.com/github/awesome-copilot"},"summary":"Slash command to evaluate whether an issue or pull request is still relevant to the project","tags":["agentic-workflow","copilot","github-actions"],"url":"https://github.com/github/awesome-copilot/blob/main/workflows/relevance-check.md"},
    {"category":"ai","fetchedAt":"2026-10-20","id":"wf-copilot:relevance-summary","kind":"workflow","license":"MIT","name":"Relevance Summary","preview":{"file":"workflows/relevance-summary.md","platform":"github-agentic-workflows","type":"template"},"source":{"name":"Awesome GitHub Copilot (agentic workflows)","url":"https://github.com/github/awesome-copilot"},"summary":"Manually triggered workflow that summarizes all open issues and PRs with a /relevance-check response into a single issue","tags":["agentic-workflow","copilot","github-actions"],"url":"https://github.com/github/awesome-copilot/blob/main/workflows/relevance-summary.md"},
    {"category":"ai","fetchedAt":"2026-10-20","id":"wf-copilot:weekly-comment-sync","kind":"workflow","license":"MIT","name":"Weekly Comment Sync","preview":{"file":"workflows/weekly-comment-sync.md","platform":"github-agentic-workflows","type":"template"},"source":{"name":"Awesome GitHub Copilot (agentic workflows)","url":"https://github.com/github/awesome-copilot"},"summary":"Weekly workflow that finds stale code comments or README snippets, makes text-only synchronization updates, and opens a draft pull request when changes are needed.","tags":["agentic-workflow","copilot","github-actions"],"url":"https://github.com/github/awesome-copilot/blob/main/workflows/weekly-comment-sync.md"}
  ]
}
