{
  "available": 14,
  "count": 14,
  "fetchedAt": "2026-10-14",
  "source": {"id":"rules-aitmpl","kind":"rules","license":"MIT (davila7/claude-code-templates)","name":"Claude Code Templates (project templates)","note":"프레임워크별 CLAUDE.md·설정 묶음","url":"https://www.aitmpl.com"},
  "items": [
    {"category":"ai","fetchedAt":"2026-10-14","id":"rules-aitmpl:templates-angular-app","kind":"rules","license":"MIT","metrics":{"downloads":0},"name":"angular-app","preview":{"agent":"claude-code","category":"frameworks","component":"template","type":"prompt"},"source":{"name":"Claude Code Templates (aitmpl.com)","url":"https://www.aitmpl.com"},"summary":"Angular-App with Javascript-Typescript","tags":["claude-code","frameworks","javascript-typescript","template"],"url":"https://www.aitmpl.com","use":{"docs":"https://www.aitmpl.com","install":"npx claude-code-templates@latest --template=angular-app --yes"}},
    {"category":"ai","fetchedAt":"2026-10-14","id":"rules-aitmpl:templates-common","kind":"rules","license":"MIT","metrics":{"downloads":0},"name":"common","preview":{"agent":"claude-code","category":"languages","component":"template","type":"prompt"},"source":{"name":"Claude Code Templates (aitmpl.com)","url":"https://www.aitmpl.com"},"summary":"Common project template","tags":["claude-code","languages","template"],"url":"https://www.aitmpl.com","use":{"docs":"https://www.aitmpl.com","install":"npx claude-code-templates@latest --template=common --yes"}},
    {"category":"ai","fetchedAt":"2026-10-14","id":"rules-aitmpl:templates-django-app","kind":"rules","license":"MIT","metrics":{"downloads":0},"name":"django-app","preview":{"agent":"claude-code","category":"frameworks","component":"template","type":"prompt"},"source":{"name":"Claude Code Templates (aitmpl.com)","url":"https://www.aitmpl.com"},"summary":"Django-App with Python","tags":["claude-code","frameworks","python","template"],"url":"https://www.aitmpl.com","use":{"docs":"https://www.aitmpl.com","install":"npx claude-code-templates@latest --template=django-app --yes"}},
    {"category":"ai","fetchedAt":"2026-10-14","id":"rules-aitmpl:templates-fastapi-app","kind":"rules","license":"MIT","metrics":{"downloads":0},"name":"fastapi-app","preview":{"agent":"claude-code","category":"frameworks","component":"template","type":"prompt"},"source":{"name":"Claude Code Templates (aitmpl.com)","url":"https://www.aitmpl.com"},"summary":"Fastapi-App with Python","tags":["claude-code","frameworks","python","template"],"url":"https://www.aitmpl.com","use":{"docs":"https://www.aitmpl.com","install":"npx claude-code-templates@latest --template=fastapi-app --yes"}},
    {"category":"ai","fetchedAt":"2026-10-14","id":"rules-aitmpl:templates-flask-app","kind":"rules","license":"MIT","metrics":{"downloads":0},"name":"flask-app","preview":{"agent":"claude-code","category":"frameworks","component":"template","type":"prompt"},"source":{"name":"Claude Code Templates (aitmpl.com)","url":"https://www.aitmpl.com"},"summary":"Flask-App with Python","tags":["claude-code","frameworks","python","template"],"url":"https://www.aitmpl.com","use":{"docs":"https://www.aitmpl.com","install":"npx claude-code-templates@latest --template=flask-app --yes"}},
    {"category":"ai","fetchedAt":"2026-10-14","id":"rules-aitmpl:templates-go","kind":"rules","license":"MIT","metrics":{"downloads":0},"name":"go","preview":{"agent":"claude-code","category":"languages","component":"template","type":"prompt"},"source":{"name":"Claude Code Templates (aitmpl.com)","url":"https://www.aitmpl.com"},"summary":"Go project template","tags":["claude-code","languages","template"],"url":"https://www.aitmpl.com","use":{"docs":"https://www.aitmpl.com","install":"npx claude-code-templates@latest --template=go --yes"}},
    {"category":"ai","fetchedAt":"2026-10-14","id":"rules-aitmpl:templates-javascript-typescript","kind":"rules","license":"MIT","metrics":{"downloads":0},"name":"javascript-typescript","preview":{"agent":"claude-code","category":"languages","component":"template","type":"prompt"},"source":{"name":"Claude Code Templates (aitmpl.com)","url":"https://www.aitmpl.com"},"summary":"Javascript-Typescript project template","tags":["claude-code","languages","template"],"url":"https://www.aitmpl.com","use":{"docs":"https://www.aitmpl.com","install":"npx claude-code-templates@latest --template=javascript-typescript --yes"}},
    {"category":"ai","fetchedAt":"2026-10-14","id":"rules-aitmpl:templates-node-api","kind":"rules","license":"MIT","metrics":{"downloads":0},"name":"node-api","preview":{"agent":"claude-code","category":"frameworks","component":"template","type":"prompt"},"source":{"name":"Claude Code Templates (aitmpl.com)","url":"https://www.aitmpl.com"},"summary":"Node-Api with Javascript-Typescript","tags":["claude-code","frameworks","javascript-typescript","template"],"url":"https://www.aitmpl.com","use":{"docs":"https://www.aitmpl.com","install":"npx claude-code-templates@latest --template=node-api --yes"}},
    {"category":"ai","fetchedAt":"2026-10-14","id":"rules-aitmpl:templates-python","kind":"rules","license":"MIT","metrics":{"downloads":0},"name":"python","preview":{"agent":"claude-code","category":"languages","component":"template","type":"prompt"},"source":{"name":"Claude Code Templates (aitmpl.com)","url":"https://www.aitmpl.com"},"summary":"Python project template","tags":["claude-code","languages","template"],"url":"https://www.aitmpl.com","use":{"docs":"https://www.aitmpl.com","install":"npx claude-code-templates@latest --template=python --yes"}},
    {"category":"ai","fetchedAt":"2026-10-14","id":"rules-aitmpl:templates-rails-app","kind":"rules","license":"MIT","metrics":{"downloads":0},"name":"rails-app","preview":{"agent":"claude-code","category":"frameworks","component":"template","type":"prompt"},"source":{"name":"Claude Code Templates (aitmpl.com)","url":"https://www.aitmpl.com"},"summary":"Rails-App with Ruby","tags":["claude-code","frameworks","ruby","template"],"url":"https://www.aitmpl.com","use":{"docs":"https://www.aitmpl.com","install":"npx claude-code-templates@latest --template=rails-app --yes"}},
    {"category":"ai","fetchedAt":"2026-10-14","id":"rules-aitmpl:templates-react-app","kind":"rules","license":"MIT","metrics":{"downloads":0},"name":"react-app","preview":{"agent":"claude-code","category":"frameworks","component":"template","type":"prompt"},"source":{"name":"Claude Code Templates (aitmpl.com)","url":"https://www.aitmpl.com"},"summary":"React-App with Javascript-Typescript","tags":["claude-code","frameworks","javascript-typescript","template"],"url":"https://www.aitmpl.com","use":{"docs":"https://www.aitmpl.com","install":"npx claude-code-templates@latest --template=react-app --yes"}},
    {"category":"ai","fetchedAt":"2026-10-14","id":"rules-aitmpl:templates-ruby","kind":"rules","license":"MIT","metrics":{"downloads":0},"name":"ruby","preview":{"agent":"claude-code","category":"languages","component":"template","type":"prompt"},"source":{"name":"Claude Code Templates (aitmpl.com)","url":"https://www.aitmpl.com"},"summary":"Ruby project template","tags":["claude-code","languages","template"],"url":"https://www.aitmpl.com","use":{"docs":"https://www.aitmpl.com","install":"npx claude-code-templates@latest --template=ruby --yes"}},
    {"category":"ai","fetchedAt":"2026-10-14","id":"rules-aitmpl:templates-rust","kind":"rules","license":"MIT","metrics":{"downloads":0},"name":"rust","preview":{"agent":"claude-code","category":"languages","component":"template","type":"prompt"},"source":{"name":"Claude Code Templates (aitmpl.com)","url":"https://www.aitmpl.com"},"summary":"Rust project template","tags":["claude-code","languages","template"],"url":"https://www.aitmpl.com","use":{"docs":"https://www.aitmpl.com","install":"npx claude-code-templates@latest --template=rust --yes"}},
    {"category":"ai","fetchedAt":"2026-10-14","id":"rules-aitmpl:templates-vue-app","kind":"rules","license":"MIT","metrics":{"downloads":0},"name":"vue-app","preview":{"agent":"claude-code","category":"frameworks","component":"template","type":"prompt"},"source":{"name":"Claude Code Templates (aitmpl.com)","url":"https://www.aitmpl.com"},"summary":"Vue-App with Javascript-Typescript","tags":["claude-code","frameworks","javascript-typescript","template"],"url":"https://www.aitmpl.com","use":{"docs":"https://www.aitmpl.com","install":"npx claude-code-templates@latest --template=vue-app --yes"}}
  ]
}
