{
  "available": 7,
  "count": 7,
  "fetchedAt": "2026-10-20",
  "source": {"id":"agent-iannuttall","kind":"subagent","license":"MIT","name":"Claude Agents (iannuttall)","url":"https://github.com/iannuttall/claude-agents"},
  "items": [
    {"category":"ai","fetchedAt":"2026-10-20","id":"agent-iannuttall:agents-code-refactorer","kind":"subagent","license":"MIT","metrics":{"updatedAt":"2025-07-25"},"name":"code-refactorer","preview":{"agent":"claude-code","file":"agents/code-refactorer.md","repoStars":2042,"tools":["Edit","MultiEdit","Write","NotebookEdit","Grep","LS","Read"],"type":"skill"},"source":{"name":"Claude Agents (iannuttall)","url":"https://github.com/iannuttall/claude-agents"},"summary":"Use this agent when you need to improve existing code structure, readability, or maintainability without changing functionality. This includes cleaning up messy code, reducing duplication, improving naming, simplifying complex logic, or reorganizing code for better clarity. Examples:\\n\\n…","tags":["claude-code"],"url":"https://github.com/iannuttall/claude-agents/blob/main/agents/code-refactorer.md"},
    {"category":"ai","fetchedAt":"2026-10-20","id":"agent-iannuttall:agents-content-writer","kind":"subagent","license":"MIT","metrics":{"updatedAt":"2025-07-25"},"name":"content-writer","preview":{"agent":"claude-code","file":"agents/content-writer.md","repoStars":2042,"type":"skill"},"source":{"name":"Claude Agents (iannuttall)","url":"https://github.com/iannuttall/claude-agents"},"summary":"Use this agent when you need to create compelling, informative content that explains complex topics in simple terms. This includes creating article outlines, writing full articles, blog posts, or any content that requires direct response copywriting skills with a focus on clarity and engagement…","tags":["claude-code"],"url":"https://github.com/iannuttall/claude-agents/blob/main/agents/content-writer.md"},
    {"category":"ai","fetchedAt":"2026-10-20","id":"agent-iannuttall:agents-frontend-designer","kind":"subagent","license":"MIT","metrics":{"updatedAt":"2025-07-25"},"name":"frontend-designer","preview":{"agent":"claude-code","file":"agents/frontend-designer.md","repoStars":2042,"type":"skill"},"source":{"name":"Claude Agents (iannuttall)","url":"https://github.com/iannuttall/claude-agents"},"summary":"Use this agent when you need to convert design mockups, wireframes, or visual concepts into detailed technical specifications and implementation guides for frontend development. This includes analyzing UI/UX designs, creating design systems, generating component architectures, and producing…","tags":["claude-code"],"url":"https://github.com/iannuttall/claude-agents/blob/main/agents/frontend-designer.md"},
    {"category":"ai","fetchedAt":"2026-10-20","id":"agent-iannuttall:agents-prd-writer","kind":"subagent","license":"MIT","metrics":{"updatedAt":"2025-07-25"},"name":"prd-writer","preview":{"agent":"claude-code","file":"agents/prd-writer.md","repoStars":2042,"tools":["Task","Bash","Grep","LS","Read","Write","WebSearch","Glob"],"type":"skill"},"source":{"name":"Claude Agents (iannuttall)","url":"https://github.com/iannuttall/claude-agents"},"summary":"Use this agent when you need to create a comprehensive Product Requirements Document (PRD) for a software project or feature. This includes situations where you need to document business goals, user personas, functional requirements, user experience flows, success metrics, technical…","tags":["claude-code"],"url":"https://github.com/iannuttall/claude-agents/blob/main/agents/prd-writer.md"},
    {"category":"ai","fetchedAt":"2026-10-20","id":"agent-iannuttall:agents-project-task-planner","kind":"subagent","license":"MIT","metrics":{"updatedAt":"2025-07-25"},"name":"project-task-planner","preview":{"agent":"claude-code","file":"agents/project-task-planner.md","repoStars":2042,"tools":["Task","Bash","Edit","MultiEdit","Write","NotebookEdit","Grep","LS","Read","ExitPlanMode","TodoWrite","WebSearch"],"type":"skill"},"source":{"name":"Claude Agents (iannuttall)","url":"https://github.com/iannuttall/claude-agents"},"summary":"Use this agent when you need to create a comprehensive development task list from a Product Requirements Document (PRD). This agent analyzes PRDs and generates detailed, structured task lists covering all aspects of software development from initial setup through deployment and maintenance…","tags":["claude-code"],"url":"https://github.com/iannuttall/claude-agents/blob/main/agents/project-task-planner.md"},
    {"category":"ai","fetchedAt":"2026-10-20","id":"agent-iannuttall:agents-security-auditor","kind":"subagent","license":"MIT","metrics":{"updatedAt":"2025-07-25"},"name":"security-auditor","preview":{"agent":"claude-code","file":"agents/security-auditor.md","repoStars":2042,"tools":["Task","Bash","Edit","MultiEdit","Write","NotebookEdit"],"type":"skill"},"source":{"name":"Claude Agents (iannuttall)","url":"https://github.com/iannuttall/claude-agents"},"summary":"Use this agent when you need to perform a comprehensive security audit of a codebase, identify vulnerabilities, and generate a detailed security report with actionable remediation steps. This includes reviewing authentication mechanisms, input validation, data protection, API security…","tags":["claude-code"],"url":"https://github.com/iannuttall/claude-agents/blob/main/agents/security-auditor.md"},
    {"category":"ai","fetchedAt":"2026-10-20","id":"agent-iannuttall:agents-vibe-coding-coach","kind":"subagent","license":"MIT","metrics":{"updatedAt":"2025-07-25"},"name":"vibe-coding-coach","preview":{"agent":"claude-code","file":"agents/vibe-coding-coach.md","repoStars":2042,"type":"skill"},"source":{"name":"Claude Agents (iannuttall)","url":"https://github.com/iannuttall/claude-agents"},"summary":"Use this agent when users want to build applications through conversation, focusing on the vision and feel of their app rather than technical implementation details. This agent excels at translating user ideas, visual references, and 'vibes' into working applications while handling all technical…","tags":["claude-code"],"url":"https://github.com/iannuttall/claude-agents/blob/main/agents/vibe-coding-coach.md"}
  ]
}
